{
  "topic": "current",
  "phase": "idle",
  "updated_at": "1970-01-01T00:00:00+08:00",
  "facts": {
    "A": "",
    "B": ""
  },
  "feelings": {
    "A": "",
    "B": ""
  },
  "needs": {
    "A": "",
    "B": ""
  },
  "pending_draft": null,
  "consents": [],
  "summary_acks": {
    "A": false,
    "B": false
  },
  "notes": ""
}
